SKU,Product Name,Description,Category,Unit of Measure,Retail Price
PF-1001,Original Protein Burrito,"Seasoned chicken, black beans, brown rice, roasted peppers, cheese & chipotle sauce in a flour tortilla. 32g protein.",Entree,Each,7.99
PF-1002,Protein Power Bowl,"Seasoned chicken, quinoa, roasted veggies, and cheese in a microwaveable bowl. 28g protein.",Entree,Each,8.49
PF-1003,Sunrise Breakfast Wrap,"Scrambled egg, turkey sausage, sweet potato & pepper jack cheese in a whole wheat tortilla. 24g protein.",Entree,Each,6.99
PF-1004,Peak Bar,"Baked protein bar with oats, peanut butter, whey protein, dark chocolate & honey. 20g protein.",Snack,Each,3.49
PF-1005,Green Fuel Smoothie Pack,"Frozen smoothie pack: spinach, banana, protein powder, almond butter & almond milk. 22g protein.",Beverage,Each,5.99
